Enter password: ****
Welcome to the MySQL monitor.  Commands end with ; or \g.
Your MySQL connection id is 13
Server version: 8.0.35 MySQL Community Server - GPL

Copyright (c) 2000, 2023, Oracle and/or its affiliates.

Oracle is a registered trademark of Oracle Corporation and/or its
affiliates. Other names may be trademarks of their respective
owners.

Type 'help;' or '\h' for help. Type '\c' to clear the current input statement.

mysql> show databases;
+--------------------+
| Database           |
+--------------------+
| information_schema |
| kanbandb           |
| myhibernate        |
| mysql              |
| performance_schema |
| polling_app        |
| sys                |
| tempdb             |
+--------------------+
8 rows in set (0.00 sec)

mysql> show databases;
+--------------------+
| Database           |
+--------------------+
| information_schema |
| kanbandb           |
| myhibernate        |
| mysql              |
| performance_schema |
| polling_app        |
| sys                |
| tempdb             |
+--------------------+
8 rows in set (0.00 sec)

mysql> create database tuition-1;
ERROR 1064 (42000): You have an error in your SQL syntax; check the manual that corresponds to your MySQL server version for the right syntax to use near '-1' at line 1
mysql> create database tuition1;
Query OK, 1 row affected (0.03 sec)

mysql> show databases;
+--------------------+
| Database           |
+--------------------+
| information_schema |
| kanbandb           |
| myhibernate        |
| mysql              |
| performance_schema |
| polling_app        |
| sys                |
| tempdb             |
| tuition1           |
+--------------------+
9 rows in set (0.00 sec)

mysql> use tuition1;
Database changed
mysql> show tables;
Empty set (0.00 sec)

mysql> SELECT * FROM polling_app.users;
+----+---------------------+---------------------+---------------------------+--------------+--------------------------------------------------------------+-----------------+
| id | created_at          | updated_at          | email                     | name         | password
                              | username        |
+----+---------------------+---------------------+---------------------------+--------------+--------------------------------------------------------------+-----------------+
|  1 | 2024-06-02 13:14:37 | 2024-06-02 13:14:37 | sahilsheikh.dev@gmail.com | Sahil Sheikh | $2a$10$gjS/Ip.au8/b0zEVP/ILC.LagRzFHLj9vnR.kV.ets6ZLY97.2JKy | sahilsheikh.dev |
+----+---------------------+---------------------+---------------------------+--------------+--------------------------------------------------------------+-----------------+
1 row in set (0.00 sec)
       SELECT * FROM polling_app.users;
+----+---------------------+---------------------+---------------------------+--------------+--------------------------------------------------------------+-----------------+
| id | created_at          | updated_at          | email                     | name         | password                                                     | username        |
+----+---------------------+---------------------+---------------------------+--------------+--------------------------------------------------------------+-----------------+
|  1 | 2024-06-02 13:14:37 | 2024-06-02 13:14:37 | sahilsheikh.dev@gmail.com | Sahil Sheikh | $2a$10$gjS/Ip.au8/b0zEVP/ILC.LagRzFHLj9vnR.kV.ets6ZLY97.2JKy | sahilsheikh.dev |
+----+---------------------+---------------------+---------------------------+--------------+--------------------------------------------------------------+-----------------+
1 row in set (0.00 sec)
       create table <table-name> (empId int, empName varchar(255), salary int);
mysql> create table <table-name> (empId int, empName varchar(255), salary int);^C
mysql> ^C
mysql> ^C
mysql> ^C
mysql>
mysql>
mysql>
mysql>
mysql>
mysql> create table employeetbl (empId int, empName varchar(255), salary int);
Query OK, 0 rows affected (0.04 sec)

mysql> show tables;
+--------------------+
| Tables_in_tuition1 |
+--------------------+
| employeetbl        |
+--------------------+
1 row in set (0.00 sec)

mysql> desc employeetbl;
+---------+--------------+------+-----+---------+-------+
| Field   | Type         | Null | Key | Default | Extra |
+---------+--------------+------+-----+---------+-------+
| empId   | int          | YES  |     | NULL    |       |
| empName | varchar(255) | YES  |     | NULL    |       |
| salary  | int          | YES  |     | NULL    |       |
+---------+--------------+------+-----+---------+-------+
3 rows in set (0.01 sec)

mysql> select * from employeetbl;
Empty set (0.00 sec)

mysql> insert into employeetbl values (101, Sahil, 100000);
ERROR 1054 (42S22): Unknown column 'Sahil' in 'field list'
mysql> insert into employeetbl values (101, 'Sahil', 100000);
Query OK, 1 row affected (0.02 sec)

mysql> select * from employeetbl;
+-------+---------+--------+
| empId | empName | salary |
+-------+---------+--------+
|   101 | Sahil   | 100000 |
+-------+---------+--------+
1 row in set (0.00 sec)

mysql> insert into employeetbl (empId, empName) values (101, 'Owais');
Query OK, 1 row affected (0.01 sec)

mysql> select * from employeetbl;
+-------+---------+--------+
| empId | empName | salary |
+-------+---------+--------+
|   101 | Sahil   | 100000 |
|   101 | Owais   |   NULL |
+-------+---------+--------+
2 rows in set (0.00 sec)

mysql> update employeetbl set(empId = 102, salary = 100000) where(empName = 'Owais');
ERROR 1064 (42000): You have an error in your SQL syntax; check the manual that corresponds to your MySQL server version for the right syntax to use near '(empId = 102, salary = 100000) where(empName = 'Owais')' at line 1
mysql> update employeetbl set empId = 102, salary = 100000 where(empName = 'Owais');
Query OK, 1 row affected (0.02 sec)
Rows matched: 1  Changed: 1  Warnings: 0

mysql> select * from employeetbl;
+-------+---------+--------+
| empId | empName | salary |
+-------+---------+--------+
|   101 | Sahil   | 100000 |
|   102 | Owais   | 100000 |
+-------+---------+--------+
2 rows in set (0.00 sec)

mysql> select * from employeetbl;
+-------+---------+--------+
| empId | empName | salary |
+-------+---------+--------+
|   101 | Sahil   | 100000 |
|   102 | Owais   | 100000 |
+-------+---------+--------+
2 rows in set (0.00 sec)

mysql> delete from employeetbl where(empId = 102);
Query OK, 1 row affected (0.02 sec)

mysql> select * from employeetbl;
+-------+---------+--------+
| empId | empName | salary |
+-------+---------+--------+
|   101 | Sahil   | 100000 |
+-------+---------+--------+
1 row in set (0.00 sec)

mysql> delete from employeetbl where(empId = 101);
Query OK, 1 row affected (0.01 sec)

mysql> select * from employeetbl;
Empty set (0.00 sec)

mysql> insert into employeetbl values (101, Sahil, 100000);
ERROR 1054 (42S22): Unknown column 'Sahil' in 'field list'
mysql> insert into employeetbl values (101, 'Sahil', 100000);
Query OK, 1 row affected (0.01 sec)

mysql> insert into employeetbl values (102, 'Owais', 100000);
Query OK, 1 row affected (0.03 sec)

mysql> insert into employeetbl values (103, 'Shadab', 100000);
Query OK, 1 row affected (0.01 sec)

mysql> insert into employeetbl values (104, 'Sanchit', 100000);
Query OK, 1 row affected (0.01 sec)

mysql> select * from employeetbl;
+-------+---------+--------+
| empId | empName | salary |
+-------+---------+--------+
|   101 | Sahil   | 100000 |
|   102 | Owais   | 100000 |
|   103 | Shadab  | 100000 |
|   104 | Sanchit | 100000 |
+-------+---------+--------+
4 rows in set (0.00 sec)

mysql> delete from employeetbl;
Query OK, 4 rows affected (0.01 sec)

mysql> select * from employeetbl;
Empty set (0.00 sec)

mysql>
